,tweets,label
2369,'Crime in Atlanta is down 18 percent since 2009.',0
2370,A photograph depicts a glamorous 'young Harriet Tubman.',1
2371,'The Obama administration just issued instructions that terrorism training should not involve any reference to Islam.',1
2372,"Porsche dealer offers “buy one, get one free” promotion.",1
2373,"'Since January 2008 the private sector has lost nearly 8 million jobs while local, state and federal governments added 590,000.'",1
2374,Young women are inserting vodka-soaked tampons as a furtive way of getting drunk.,1
2375,Planned disposal of one animal precipitates the shooting of others.,1
2376,Donald Trump plagiarized portions of 'Bee Movie' and 'Avatar' for his inaugural address.,1
2377,20 claims by Lagos governor hopefuls checked,1
2378,Prophylactic maker Durex is producing an eggplant-flavored condom.,1
2379,'ICE has not deported or detained one white illegal immigrant.',1
2380,Says pre-cut onion used to cook the following day 'becomes highly poisonous for even a single night and creates toxic bacteria which may cause adverse stomach infections because of excess bile secretions and even food poisoning.',1
2381,The legal drinking age has been raised to 23.,1
2382,A precinct in the Allen West-Patrick Murphy recount has '7 registered voters in Guatemalan community and the tally showed 900 voted!!!!!',1
2383,"According to a recent poll, 'there are more young Republicans enrolled in their parents' (health insurance) plans than young Democrats.'",0
2384,"'When Social Security first started, there was 16 workers for every retiree. Today there are three workers for every retiree and soon there will be only two for every retiree.'",0
2385,'Irish superstar Saoirse Ronan dies after on-set accident in St. Lucia.',1
2386,Says Senate candidate Katie McGinty 'made thousands from companies she previously regulated.',0
2387,An image of a plant with phallic-looking structures is a genuine botanical specimen.,0
2388,"Quotes Thomas Jefferson as saying 'When governments fear the people, there is liberty. When the people fear the government, there is tyranny. The strongest reason for the people to retain the right to keep and bear arms is, as a last resort, to protect themselves against tyranny in government.'",1
2389,"Says U.S. Rep. Alexandria Ocasio-Cortez said 'owning guns IS NOT a right, if it were a right it would be in the Constitution.'",1
2390,"In September 2017, the Cleveland Browns, Dallas Cowboys and Pittsburgh Steelers refunded season tickets in light of protests by players during the National Anthem.",1
2391,The 'Podesta e-mails' revealed the existence of a secret society of pedophiles operating through a pizza place loosely connected to Clinton associate David Brock.,1
2392,Television news screen shot captures President Bush with an inadvertently humorous caption.,0
2393,'All of our taxpayers are paying roughly 22% of the U.N. budget.',0
2394,A woman intent upon looking her best for a big day treats herself to far too many tanning sessions and cooks herself to death.,1
2395,Delta Air Lines gives members of Planned Parenthood discounted rates on air travel.,1
2396,"'Who’s really behind Jeanne Ives’ campaign for governor? Mike Madigan’s corrupt insider machine. They’ve bankrolled her campaign with thousands in shady labor union cash, turning Ives into another Madigan lackey.'",1
2397,A photograph shows the wedding of a U.S. Marine disfigured by combat wounds.,0
2398,Bishop Fulton Sheen foretold the death of Stalin on his TV show.,0
2399,The state of Wisconsin banned all FoodShare/EBT programs through 2019 due to budgetary concerns.,1
2400,'Statistics show 2 to 3 Texas women per week have major complications and 10 women per week seek help at an ER after an abortion.',1
2401,"'In writing his book, Gov. Perry pointed out that … by any measure Social Security has been a failure.'",0
2402,An ISIS jihadist converted to Christianity after being left for dead and rescued by Christian missionaries.,1
2403,A photograph shows a black woman named Malinda Borden who was denied a spot in a lifeboat on the Titanic because she was black.,1
2404,FBI Issues Warrant for Obama's Arrest in Trump Wiretap Scandal,1
2405,The federal government is preventing Volkswagen’s XL1 model car from being sold in the U.S. because the vehicle is too fuel-efficient.,1
2406,Barack Obama began his presidency 'with an apology tour.',1
2407,"'When people enter the service, there’s not a mental health evaluation.'",0
2408,The Eagles song “Hotel California” is about Satanism.,1
2409,E-mail reproduces George Carlin’s list of New Rules for 2006.,1
2410,A planet-dissolving dust cloud will wipe out our solar system in December 2014.,1
2411,"President Trump said 'I met with the president of the Virgin Islands,' a U.S. territory of which Trump is the chief of state.",0
2412,Rep. Robert Pittenger 'stood against funding for the border wall.',1
2413,Consumers are not obligated to pay back debt that creditors have written off and sold.,1
2414,Singer Lee Greenwood cancelled a Denver concert appearance at the last minute over a pay dispute.,0
2415,A photograph shows the height disparity between political reporter George Stephanopoulos and U.S. President Donald Trump.,1
2416,Says she is 'saving ratepayers $6 million/year.',1
2417,'Marijuana is less addictive than both alcohol and tobacco.',0
2418,Says 'Nancy Pelosi came out in favor of MS-13.',1
2419,'There is no good data showing secondhand smoke kills people.',1
2420,"When Social Security, Medicare and Medicaid were created, 'Republicans stood on the sidelines'",1
2421,'We’re second only to Boston in college students per capita.',1
2422,Netflix CEO Reed Hastings said that Donald Trump 'would destroy much of what is great about America.',0
2423,'Electoral College elector commits suicide to avoid voting for Donald Trump.',1
2424,"The Make-a-Wish Foundation will donate 7¢ per per e-mail forward towards the care of 23-year-old Matt Dawson, who is dying of lung cancer and a brain tumor.",1
2425,A video shows an ice fisherman getting eaten by an orca.,1
2426,Spicer: 'Trump has the legal right to cancel SCOTUS because they serve at his pleasure',1
2427,Demand Protest Paying Protestors to Disrupt Trump Inauguration,1
2428,Eelskin wallets demagnetize credit cards due to leftover charges from the electric eels used to make them.,1
2429,An Immigration and Customs Enforcement (ICE) agent left a suicide note warning of looming mass disarmament and collapse in the United States.,1
2430,"In July 2019, the state of California banned the sale of Hunt's 'Manwich' sauce, or the use of the word 'Manwich.'",1
2431,"'In 2005, Dan Branch tried to expand third-trimester abortions in Texas.'",1
2432,A competitor one-ups a company proud of their new ultra-thin wire by drilling a hole through it.,1
2433,A photograph shows Canadian Prime Minister Justin Trudeau watering a tree in the rain.,1
2434,Archaeologists dug up an 800-year-old alien cellphone in Austria.,1
2435,Texas would have to increase current state spending by 28 percent just to reach the national average for spending per resident.,0
2436,'Suicide is the second-leading cause of death among 15-19 year olds and 25-34 year olds in Missouri.',0
2437,Rep. Elijah Cummings sponsored a bill intended to 'keep all of Barack Obama's records sealed.',1
2438,'Hillary Clinton furious at ‘special gift’ Melania Trump sent her from her hospital bed',1
2439,An image contrasts radically different gun laws and homicide rates in Honduras and Switzerland.,1
2440,Jack Benny arranged to have a single red rose sent to his wife every day after he was gone.,0
2441,'We don’t have a (military) reserve force if something happens.',1
2442,Ted Cruz said that veterans should start selling cookies in order to raise funds.,1
2443,Says state Senate candidate 'Monk Elmer voted to exceed the (school district property tax) spending caps.',1
2444,Jimmy Carter said that the novelty of electing a woman president should not outweigh the duty of electing an honest president.,1
2445,"Quotes Ronald Reagan as saying, 'Under no pretext should arms and ammunition be surrendered; any attempts to disarm the people must be stopped, by force if necessary.'",1
2446,"'Democrats Filing TREASON Charges Against Trump, McConnell, Giuliani, & Comey.'",1
2447,"'Obama's Justice-designate Sotomayor threw out (the New Haven firefighters') lawsuit in a sneaky, unsigned opinion -- the judicial equivalent of 'talk to the hand.''",1
2448,Joe Biden 'voted against the first Gulf War. He opposed the surge. He wanted to partition Iraq.',0
2449,The Rhode Island Parole Board 'never received an objection from the attorney general' to the parole of  convicted murder Alfred Brissette.,0
2450,Marshalls employees in Puerto Rico are still being paid despite the damage to stores there caused by Hurricane Maria.,0
2451,"Says 'No, I don't benefit, I don't benefit' from his tax proposal.",1
2452,'Do this research … watch how much crime picks up if you take away [football].',1
2453,A photograph shows President Donald Trump with his wife Melania Trump and his alleged mistress Stormy Daniels.,1
2454,An 'extreme snuff film' in which Hillary Clinton and aide Huma Abedin are seen raping and mutilating a prepubescent girl is circulating on the dark web under the code name 'Frazzledrip.',1
2455,"Says a photo of Trump smiling with staff at a hospital in Dayton, Ohio, was staged and the nurses were paid actors.",1
2456,A photograph shows a hermit crab using a human skull as a shell.,1
2457,The Treasury is recalling one state’s quarters because they’re jamming coin slots.,1
2458,"In 2013, Donald Trump extended his best wishes to all, even the 'haters and losers,' via Twitter on the anniversary of 9/11.",0
2459,The letters ‘JS’ can be found on the U.S. dime and represent the initials of Josef Stalin.,1
2460,“One doctor to less than 300 patients in South Africa’s private healthcare sector”,1
2461,A video shows Black Lives Matter protesters in Charlotte attacking and beating a homeless vet.,1
2462,A photograph shows a lake that resembles a Teletubby character.,1
2463,Anthony Hanes was mugged in a 'drug dealing neighborhood' while doing an online challenge inspired by the movie 'Bird Box.',1
2464,A transcript documents that Donald Trump gave a self-aggrandizing toast at his daughter Ivanka's wedding.,1
2465,Canada suffered a major donut shortage shortly after the country legalized recreational marijuana use.,1
2466,Photograph shows crates in which calves are kept immobilized for six weeks before they are slaughtered for veal.,1
2467,"Says Sen. Robert Cowles, her recall opponent, supported the sale of state-owned power plants 'not to the highest bidder, but to the biggest donors' with no oversight.",1
2468,Says the D.C. city council passed a law banning lethal rat trapping.,1
2469,'Who can you thank for rising prices at the pump? O-ba-ma! O-ba-ma!',1
2470,"'We passed without, frankly, the help of the Republican caucus, we passed 25 tax cuts last year, mostly aimed at the middle class and small businesses.'",0
2471,U.S. Ambassador to the United Nations Nikki Haley 'accidentally confessed`-to being romantically involved with President Trump.,1
2472,"'Democrats go full tyranny: now demand nationwide gun confiscation from law-abiding Americans ... at gunpoint, of course.'",1
2473,'We've got some 37-million of our fellow citizens who are living in poverty; about 12-million or 13-million are children.',0
2474,'The collective net worth of Americans has taken a $5.5 trillion hit ... mainly due to plummeting home values.',0
2475,Alabama utility crew workers were turned away from helping repair storm-ravaged areas of New Jersey because they were not union members.,1
2476,The White House ordered a change to military funeral protocol to remove references to the President of the United States.,1
2477,Says Hillary Clinton's health care plan from the 1990s 'had a broader provision in favor of corporate right to back out' of providing contraceptive coverage than the one created by the Hobby Lobby Supreme Court decision.,1
2478,Says the 'last non-partisan commission to improve the voting experience in America concluded that #VoterID was necessary.',0
2479,"'30,000 scientists have come forward confirming that man-made climate change is a hoax perpetuated by the elite in order to make money.'",1
2480,A photograph showing President Obama with a man sleeping on the subway is genuine.,1
2481,'Eighty-three law enforcement officers have died in the line of duty this year. Twenty-four of them were shot and killed in cold blood.',0
2482,"'Each year, 18,000 people die in America because they don't have health care.'",0
2483,Israel's per capita income 'is greater than probably three-fourths of the rest of the world.',0
2484,Maryland is 'creating jobs at 2 ½ times the rate that Virginia is.',1
2485,Charleston church shooter Dylann Roof is actually a former child star and crisis actor named John Christian Graas.,1
2486,Says Shaquille O’Neal said Donald Trump 'is possibly the best president.',1
2487,"Duane Devane, a Medal of Honor recipient, died after being turned away from a hospital in Atlanta on the basis that he had no health insurance.",1
2488,"The Trump resort where U.S. President Donald Trump suggested the next G7 summit be held was sued over bed bugs, and the lawsuit was settled out of court.",0
2489,Singer Avril Lavigne died and was replaced by a doppelgänger.,1
2490,"'China will be allowed to build hundreds of additional coal plants. So we can’t build the plants, but they can, according to this (Paris) agreement.'",1
2491,The health care law includes tort reform.,1
2492,A photograph shows a security wall outside Joe Kennedy's Palm Beach house.,1
2493,A fourth-grade student was suspended for saying ‘Merry Christmas’ to his teacher.,1
2494,"Andrew Scheer: “When other ministers were found to have broken the rules, they had to pay the money back.” - FactsCanada",0
2495,Coded images in oil paintings reveal plans for an upcoming “massive germ attack on the U.S.”,1
2496,'John McCain was pardoned for treason',1
2497,A photograph shows a bear chasing a cyclist down a mountain road.,1
2498,Australia is microchipping its public.,1
2499,A photograph shows Albert Einstein riding a bike while an atomic explosion takes place in the background.,1
2500,Says Jake Tapper said Allahu Akbar was a 'beautiful phrase' after a terrorist attack in New York.,1
2501,"'1928 was last time Republicans had the White House, the House and the Senate.'",1
2502,Will Smith and Jada Pinkett Smith have purchased the BET channel.,1
2503,The ritual of clinking glasses evolved from efforts to prove that the drinks contained therein were not poisoned.,1
2504,'Nearly 20% of our residents' are born abroad.,0
2505,"The 2016 federal omnibus spending bill 'funds illegal immigrants coming in and through your border, right through Phoenix.'",1
2506,"Says Joe Biden said Jon Corzine is 'the smartest guy that I know, in terms of the economy and on finance, I really mean this.'",0
2507,'Ninety percent of the topsoil has inadequate moisture to grow crops.',0
2508,"In January 2018, Senator Tom Cotton called for drug testing for Social Security recipients.",1
2509,Says a photo taken in England shows 'thousands of English Trump supporters' celebrating the president’s visit.,1
2510,A bill backed by Sean Duffy and other House Republicans 'could actually require the Internal Revenue Service to conduct audits of rape victims' who get an abortion.,1
2511,Says David Jolly lobbied 'for government-run health care just last year.',1
2512,The Republican Party has hypocritically declared their national convention to be a 'gun-free zone.',1
2513,Olive Garden restaurants are offering free $500 gift cards for fans who sign up through its Facebook site.,1
2514,Says a recent opioid bill that reached his desk had 'very little Democrat support.',1
2515,"'The most likely triggering cause of (microcephaly)' is the 'DTaP shot, a vaccine that had been recently mandated by the Brazilian government to be injected into pregnant women.'",1
2516,Says Obama is only president in history who has deliberately removed the words 'endowed by their Creator' when referring to the Declaration of Independence.,1
2517,New Canadian polymer bills melt easily.,1
2518,Steve Poizner 'increased his department's budget nearly 14 percent.',1
2519,A roadside samaritan renders innovative assistance to a stranded motorcyclist.,1
2520,"A magazine advertisement from the 1950s promoted a handgun for women's use with the slogan 'for that strange, depraved creep who won't leave you alone.'",1
2521,"Says Supreme Court nominee Merrick Garland 'voted, so the folks know, in Washington, D.C., to keep guns away from private citizens.'",1
2522,"'The Price is Right' host Bob Barker died in July 2017, after falling and hitting his head at his home.",1
2523,Willie Nelson fell seriously ill in May 2018.,1
2524,The proposed raises for the Norcross City Council would put it in line with other liked-sized communities.,0
2525,The incandescent light bulb 'has no effect whatever on the planet.',1
2526,"Newt Gingrich once said, “People like me are what stand between us and Auschwitz.”",0
2527,Doors singer Jim Morrison has been found alive in a Paris retirement home.,1
2528,"'We had a massive landslide victory, as you know, in the Electoral College.'",1
2529,"Says Ted Cruz 'was just bribed by the Kochs to introduce a bill that would give them and their allies America’s national forests, parks, and other public lands and open them for mining, drilling, fracking and logging.'",1
2530,Says Ted Cruz distributed the ad showing a nude Melania Trump on a rug.,1
2531,Raven Symone said Bill Cosby “drugged and raped” her after The Cosby Show‘s last episode.,1
2532,"On Facebook, White House Press Secretary Sarah Huckabee Sanders proudly embraced an unflattering comparison to Aunt Lydia from the Handmaid's Tale.",1
2533,"Under Rosemary Lehmberg, the 'Travis County D.A.’s office' convened the grand jury that indicted Rick Perry.",1
2534,"The proposed mine in northern Wisconsin would be built without any government oversight, and will be nine miles long.",1
2535,A man was burned to death attempting to rescue his dog from a boiling hot spring.,0
2536,A vacationing couple staying in a foul-smelling motel room discovered a body hidden under their bed.,0
2537,"Trump Gave $25,000 to Veteran Freed from Mexican Jail",0
2538,Huntingdon Life Sciences is offering to pay cash for cats and dogs rescued from New Orleans.,1
2539,News Article Said Vice President Biden's Weekend Trips Cost Taxpayers $1 Million Annually,0
2540,A video shows a group of unidentified flying objects over Oklahoma City.,1
2541,Rush Limbaugh accused President Obama and the Democrats of recruiting lesbian farmers to 'attack' conservative rural areas of the U.S.,0
2542,A photograph shows President Trump and Saudi leaders touching a glowing orb.,0
2543,"A photograph shows the Arch of Baal erected on the National Mall in Washington, D.C.",0
2544,Pilot Flying J is removing American flags from their truck stop flagpoles because the flags 'offend foreigners.',1
2545,"Indonesian villagers captured a 49-foot, 983-pound python.",1
2546,"Says his proposed payroll tax cut 'will mean an extra $1,500 in your pocket compared to if we do nothing.'",0
2547,Fox News didn't report breaking political news about the indictment of Paul Manafort and instead ran coverage of controversy involving a cheeseburger emoji.,1
2548,"'Georgia mosque keeps Hurricane Harvey donations, will send to Syrian refugees instead'",1
2549,"Prince invested in Nike in 1971, recruited NBA star Michael Jordan to the company in 1983, and designed the first Air Jordan shoe.",1
2550,Says the U.S. Senate has passed 'a budget' over the last three years 'called the Budget Control Act.',1
2551,A female rape victim was arrested after she took revenge on her attacker by stripping the skin off his genitals using a potato peeler.,1
2552,Senator Bernie Sanders wrote on Twitter that he wanted to destroy capitalism and 'dethrone God.',1
2553,'We're now the No. 1 producer of oil in the world. We've surpassed Saudi Arabia.',0
2554,A pact with the Devil to save a cancer-stricken child resulted in the creation of the Hello Kitty brand.,1
2555,"Photographs show a 'mummified' dinosaur fossil discovered in Alberta, Canada.",0
2556,CNN was caught staging a dramatic rescue during Hurricane Harvey.,1
2557,"Under a bill before the legislature, 'you’d have to go to court to fire an employee.'",1
2558,The U.S. military awards “Courageous Restraint Medals” to soldiers who refrain from firing their weapons.,1
2559,Listing yourself as your friend on Facebook creates an open door for hackers.,1
2560,"'In K-12 education, our kids are scoring at the bottom of science and mathematics right now in the industrialized world -- at the bottom.'",1
2561,"In 2017, ICE 'arrested more than 127,000 illegal immigrants with criminal convictions or facing charges of breaking our nation's’ laws,' and removed nearly 5,000 gang members.",0
2562,'Fox News Sandra Smith: ‘Everybody could see from the United Airlines passenger’s behavior that he was not a genuine American.’ ',1
2563,Microwave ovens were banned in the USSR in 1976 to protect its citizens from harmful health effects.,1
2564,"'There are 300,000 babies born deformed every year in this country because of women who are alcoholics while they're carrying those children to term.'",1
2565,Photo shows members of the migrant caravan dragging a Mexican official.,1
2566,"As of June 2019, the United States was ranked as having the cleanest air in the world.",1
2567,Several rescued horses in the Niagara Falls area are in need of adoption.,0
2568,"President Ronald Reagan once said, “Nancy Pelosi is extremely evil” because she is a member of the politically connected D'Alesandro family.",1
2569,U.S. President Donald Trump personally donated $1 million to the relief fund for the Bahamas after Hurricane Dorian.,1
2570,The cover of Disney's 'The Little Mermaid' home video includes a phallus deliberately drawn by a disgruntled artist.,1
2571,"”Over 175,000 Kenyans have already registered under the voluntary scheme known as ‘boma yangu.”",0
2572,Two claims on teen pregnancy and childbirth in South Africa,0
2573,"Caltech sent its people home on 12 April 2010, warning that an earthquake would strike within two days.",1
2574,"'Close to half of the children' in California are 'at or near poverty,' when you consider cost-of-living.",0
2575,"In 1970, the Oregon Department of Transportation attempted to dispose of a whale carcass by blowing it up.",0
2576,“Compliance levels with parole and probation conditions have improved to reach a historic mark of 98%.”,1
2577,The presence of gorillas calls into question the concept of evolution.,1
2578,"Paul Ryan endorsed 'antifa,' saying that they stood for the 'greater good.'",1
2579,Actor Gary Sinise posted a witty retort  after Hillary Clinton tweeted a message about gun control.,1
2580,"Buyer who answers unbelievable ad in paper offering a vintage Corvette for a pittance discovers the car belonged to the seller’s son, who was killed in Vietnam, and is being offered for so low a price because the bereaved mother has no inkling of the vehicle’s true value.",1
2581,Accused Fort Hood shooter Nidal Malik Hasan has continued to draw his salary while awaiting trial.,0
2582,"In a leaked e-mail, Hillary Clinton said 'we must destroy Syria for Israel.'",1
2583,"Donald Trump donated $50,000 to ensure suspected Charleston church shooter Dylann Roof was transferred to a 'safer' prison.",1
2584,Signs letter saying Consumer Product Safety Commission is acting 'without consultation or input from the company' to stop the sale of Buckyballs.,1
2585,Porn star Sasha Grey was killed by Ukranian military forces.,1
2586,PETA placed bricks with hidden messages at baseball parks.,0
2587,Says gun ownership information could be recorded and collected by the federal government and insurance companies as part of the federal health care law.,1
2588,Participating in the Facebook “giraffe challenge” will infect your computer and give hackers access to your account.,1
2589,Says Barack Obama grew up in Kenya.,1
2590,The state of Missouri named a stretch of highway adopted by the Ku Klux Klan the “Rosa Parks Highway.”,0
2591,"In the 1980s, 'The lowest income people had the biggest gains.'",1
2592,General Norman Schwarzkopf authored a pithy quote about whether we should show forgiveness towards those who harbored terrorists.,1
2593,Pantene shampoo and conditioner leave a build-up on hair that causes it to heat up and 'smoke' when combined with highlight foils.,1
2594,'When I was U.S. Attorney we wound up putting 10 percent of the state Legislature in jail during my seven years.',1
2595,Photograph shows sunrise through the World Trade Center towers.,0
2596,Schools in the UK no longer teach about the Holocaust for fear of offending Muslim students.,1
2597,"Former NFL quarterback Kurt Warner married a woman who had two children, one a special needs child.",0
2598,"Says opponent Bill Flores helped run a company that laid off over 3,000 workers and paid off executives with millions.",1
2599,"'Trump just gave every working, legal man, woman and child in the USA $612 each!'",1
2600,"Sam’s Club and Walmart donated $10,000 to the Darren Wilson defense fund.",1
2601,Starbucks is giving away free coffee for a year to anyone who can damage their new 'shatter-proof' windows.,1
2602,Latina who enthusiastically supported Donald Trump on stage in Las Vegas in October 2015 has been deported.,1
2603,Canadian officials planted a 'privacy hedge' along that country's border with the U.S.,1
2604,Barack Obama has announced that he is running for a third term as president.,1
