,tweets,label
1192,Terrorists purchased large amounts of candy from Costco stores in New Jersey just before Halloween 2001.,1
1193,"Nathan Cullen: “400,000 manufacturing jobs have been lost in Canada since 2004 … 50,000 just in the auto sector alone.” - FactsCanada",0
1194,A 1986 diary entry by President Ronald Reagan described George W. Bush as a “shiftless ne’er-do-well.”,1
1195,Says she 'wiped out' the state Agriculture Department’s inspections of eggs at retail sites like grocery stores.,1
1196,The 'stand your ground' law caused the shooting death of Trayvon Martin.,1
1197,Says a 'Local Hero' was 'arrested after killing 30 pedophiles in murder spree',1
1198,The GOP platform that seeks further limits on abortion and is silent on an exception for rape 'has been there for more than 30 years.',0
1199,The U.S. Postal Service is selling Queen Michelle Obama stamps.,1
1200,A set of images shows Disney's upcoming live-action remake of the movie 'Lilo and Stitch.',1
1201,Stolen Exam,1
1202,A video documents search engine Google manipulating results in favor of Hillary Clinton.,1
1203,Pink Cross Publishing is about to publish a gay revision of the Bible.,1
1204,Oprah Winfrey has posted bail for ‘sexy felon’ Jeremy Meeks.,1
1205,"Photographs shows a giant, man-eating catfish caught in a Chinese reservoir.",1
1206,Five claims about the ruling party's achievements.,1
1207,"In the wake of a missile strike ordered by President Trump on Syria in April 2017, senior White House officials admitted that it served no actual purpose.",1
1208,'So many of these people that commit the mass murders end up being Democrats.',1
1209,"Contends that President Obama 'literally said (if) his cap-and-trade proposals were to pass, that utility rates, his words now, would, 'necessarily skyrocket.''",0
1210,A video shows a man vaporized instantly from electrocution and/or exposure to hydrofluoric or “sulfuric hydrofluoric' acid.,1
1211,The $290 million structural surplus in the 2011-’13 Wisconsin budget is not real because it is based on the assumption that Congress will reinstate the estate tax.,1
1212,Says Tony Thurmond was 'sued by the ACLU' for leaving students in unsafe conditions.,1
1213,Says Hillary Clinton 'wants to raise taxes on African-American owned businesses to as much as nearly 50 percent more than they're paying now.',1
1214,A hunter from Michigan was nearly killed by a sexually voracious moose.,1
1215,'Trump: police officers and firefighters make too much money…hits them with tax penalty.',1
1216,The Trump administration’s policy of separating families is 'the same way Barack Obama did it.',1
1217,'Solar panels drain the sun’s energy.',1
1218,"Thanks to lobbying, Florida homeowners were unable to use solar panels during Irma to generate electricity.",1
1219,Super Bowl quarterback was formerly a foreign soldier who could toss grenades well.,1
1220,'Racist picture of Democrat North Carolina Governor Roy Cooper emerges just days after he called on Ralph Northam to resign - DAILY MAIL.',1
1221,'Most Texans aren't millionaires.',0
1222,“CDC whistleblower” Brent Hopskins revealed that all doses of the Ebola vaccine contain an RFID chip.,1
1223,"Thieves make off with a suitcase, then find out it contains a wildcat.",1
1224,"'Believe it or not, consumer spending is up over the last eight months.'",0
1225,"Mark Zuckerberg is giving $1,000 away to Facebook users who refrain from sharing hoaxes.",1
1226,"A bipartisan background check amendment 'outlawed any (gun) registry.  Plain and simple, right there in the text.'",0
1227,"'Bill Young uses his campaign money for, among other things, a luxury car.'",0
1228,DNC staffer Seth Rich was gunned down to prevent him from meeting with the FBI over plans to testify against Hillary Clinton.,1
1229,A woman becomes suspicious of the contents of a letter a blind man asks her to deliver when she sees him scurry away without the aid of his cane.,1
1230,A study of private bail bond systems 'showed that Wisconsin has a higher no-show rate than other states' of defendants skipping court appearances.,1
1231,A boy’s mother becomes pregnant after using the same bathwater he’d ejaculated in.,1
1232,President Obama signed an executive order allowing the use of the U.S. military against American citizens.,1
1233,'Amongst graduates it is only 5% who are unemployed”,0
1234,AIG 'said they were giving $57 million (in retention payments) to people who were being terminated.',0
1235,"A photograph captures wildlife fleeing a fire in Bitterroot Forest, Montana.",0
1236,A new policy implemented in November 2018 banned Navy SEALs from wearing blackface during covert operations.,1
1237,'It's been nearly three weeks since the president has commented' on questions about possible hidden wait lists at veterans hospitals.,0
1238,Hillary Clinton Received Debate Questions in Advance,1
1239,The Swedish navy once mistook minks for enemy submarines.,0
1240,A photograph shows a hearse being towed away in the middle of a funeral procession.,1
1241,Water boiled in a microwave oven can suddenly “explode.”,0
1242,"A viral animation shows a myosin molecule transporting endorphins, which can be thought of as a visual representation of the feeling of happiness.",1
1243,'Middle-class income rose to a record level in 2017 as the strong economy lifted the fortunes of more Americans.',0
1244,Youths shoot a patrol car parked as a “speeder deterrent” on the one day it contains a real cop.,1
1245,'When I saw corruption and sexual harassment cover-ups I called on Sheldon Silver to resign.',0
1246,Says President John F. Kennedy released a star Green Bay Packer from military reserve duty so that he could play in the 1961 NFL Championship Game.,0
1247,”Since its inception 3.881 million tonnes of cargo have been transported on the standard-gauge railway line.”,0
1248,Scientists found a crystal pyramid on the ocean's floor beneath the Bermuda Triangle.,1
1249,Some 90 pounds of cocaine was found on a cargo ship owned by U.S. Senate Majority Leader and anti-drug politician Mitch McConnell.,1
1250,"Says that under Texas law, it takes six years to close a failing school.",1
1251,"Bill Nye tweeted to ask if a person was 'made of copper, nitrogen, terbium, and silver.'",1
1252,Says the Obama administration 'didn't lock people up in cages.',1
1253,Says a photo shows that climate change protesters left trash all over their protest side.,1
1254,Justin Trudeau: Flaherty told Ontarians they had “no one to blame but themselves” for losing manufacturing jobs - FactsCanada,1
1255,Donald Trump admitted on Twitter that he was a political plant for Hillary Clinton.,1
1256,The abbreviation 'LOL' means 'Lucifer Our Lord' and is used in prayer by Satanists.,1
1257,Ongoing tetanus vaccine campaigns in Kenya are a ruse to sterilize women of childbearing age.,1
1258,'We maintain this (Missouri highway) system with one of the lowest levels of funding in the country.',0
1259,Says the 'number-one source' of illegal immigration 'is people legally coming to the United States on a tourist visa or a student visa and then disappearing into the population and never being heard from again.',1
1260,Chester Bennington and Chris Cornell were murdered because they were about to reveal a ring of pedophiles.,1
1261,The DOJ changed the definition of domestic violence on their website without explanation.,0
1262,"'When you tally up their representation in Congress and governorships, the Democrats almost have their lowest representation in about 100 years.'",0
1263,Marisa Tomei was awarded the Academy Award for Best Supporting Actress in 1993 because Oscar presenter Jack Palance read the wrong name by mistake.,1
1264,Says President Donald Trump said asylum seekers 'aren't people. These are animals.',1
1265,The National Rifle Association was formed for the express purpose of driving out the Ku Klux Klan and helping freed slaves defend themselves against racist attacks.,1
1266,President Obama signed an executive order to replace Supreme Court Justice Antonin Scalia with Rashad Hussain.,1
1267,Meryl Streep was fired by director Ron Howard from a from a 'Happy Days' reboot project for lying about Donald Trump mocking a disabled reporter.,1
1268,Plastic soda bottles left in unsuspecting residents' yards may be bottle bombs.,0
1269,The United States has seen 'a net loss of people with health insurance' because of Obamacare.,1
1270,Is Nairobi's governor right that the city 'never had' a development plan before him? | Africa Check,1
1271,Says U.N. arms treaty will mandate a 'new international gun registry.',1
1272,Playing a word definition game at FreeRice.com results in food being donated to the needy.,0
1273,U.S. law allows all Americans to opt out of the Affordable Care Act’s individual health insurance mandate.,1
1274,Jared Kushner scrubbed his Twitter account shortly after Special Counsel Robert S. Mueller III revealed charges against three former Trump campaign officials in October 2017.,1
1275,A photograph shows a Japanese Giant Emperor Moth.,1
1276,A letter from actor Sean Connery rejects an offer for him to become a pitchman for Apple Computers.,1
1277,"'If lawmakers fail to avert the fiscal cliff, 18 percent of the federal money that is sent to the states will be eliminated.'",1
1278,A photograph shows a rare Nagapushpa flower that blooms only once every 36 years.,1
1279,Video clip shows an airplane making a safe landing after losing a wing.,1
1280,Says she’s 'tried over 100 jury cases in Travis County courts.',1
1281,"Between January 2017 and March 2018, Diahann Carroll publicly praised and defended President Donald Trump and pleaded with Democrats to end their criticism of him.",1
1282,"Says Paul Workman 'voted in the Democrat primary, supporting Democrats with his vote.'",0
1283,Salvation Army bell-ringers keep a portion of the monies deposited into their kettles.,1
1284,A wife punishes her husband’s infidelity with a hot curling iron up his backside.,1
1285,Comedian Martin Lawrence was found dead in a hotel room.,1
1286,"At the State of the Union address, Democrats, 'even on positive news … were like death and un-American. Un-American. Somebody said, ‘treasonous.’ I mean, yeah, I guess, why not? Can we call that treason? Why not?'",1
1287,A photograph shows a woman wearing a sign reading 'My Legs Are Open for Refugees.',1
1288,"SA president slips up: $13.4 BILLION invested in renewables, not $14 MILLION | Africa Check",1
1289,'Granite Staters who hold individual policies from Anthem...can indeed renew their policies and keep their current doctors and hospitals' in 2014.,0
1290,Georgia ranks No. 9 in the rate of women murdered by men.,0
1291,The American interstate highway system was designed to be used for emergency airstrips in case of war.,1
1292,The federal health care law is 'probably the biggest tax increase ever in the history of our country.',1
1293,Says Kurt Schrader 'cast the deciding vote that failed to extend tax cuts for Oregon’s middle-class families and small businesses.',1
1294,An international cookbook compiled by California home economics teachers includes a recipe for “Stuffed Camel.”,0
1295,A video shows Dutch politician Tunahan Kuzu putting a grilled cheese in his pocket before an interview.,1
1296,E-mail offers an Oakland high school student’s Ebonics competition-winning translations of rap lyrics.,1
1297,The discount chain E.J. Korvette took its name from a shortening of ‘eight Jewish Korean War veterans’ in honor of its founding partners.,1
1298,"Parking lot carjackers are placing flyers or $100 bills on the windows of automobiles, then taking the cars when drivers step out of their vehicles to remove them.",1
1299,'I've never supported a payroll tax.',1
1300,U.S. Rep. Ilhan Omar once said: 'We are not here to be part of America. We are here to take over America.',1
1301,The intersection of a rainbow and tornado is called a 'tornabow.',1
1302,"In February and March 2018, hundreds of Canadian doctors signed a petition asking for the cancellation of pay deals from which they would personally benefit.",0
1303,"'In the last 50 years, (the federal government has) only balanced the budget five times.'",0
1304,'Vietnamese is the third most commonly spoken language in Texas.',0
1305,"Says Travis County, home to Austin, is the most liberal county in the United States.",1
1306,A former Army sniper shot three violent home intruders in the course of their victimizing a neighbor's household.,1
1307,A photograph shows President Donald Trump sitting with Liberace.,1
1308,A photograph shows a genuine quintuple skull.,1
1309,"'We're experiencing a net outflow of illegal, undocumented workers from America back to Mexico.'",0
1310,The hats for Donald Trump’s campaign are manufactured in China.,1
1311,"“Maternal mortality fell from 488 deaths per 100,000 lives to 362 deaths per 100,000.”",0
1312,Clip from a Bob Hope movie describes Democrats as “zombies.”,0
1313,First Lady Melania Trump posted a tweet that was arranged in a way that the first letters of each line spelled out the word 'HELP.',1
1314,Hillary Clinton's campaign manipulated a photograph to increase the crowd size at one of Bill Clinton's appearances.,1
1315,"Seven days before John F. Kennedy was assassinated he said, 'There’s a plot in this country to enslave every man, woman and child. Before I leave this high and noble office, I intend to expose this plot.'",1
1316,Photograph shows an advisory sign explaining priority seating for Japanese metro train passengers.,1
1317,Says there were only 'about eight or 10' inflammatory sentences in his newsletters.,1
1318,The Amish Brotherhood have endorsed Donald Trump for president.,1
1319,Says Melania Trump hired exorcist to 'cleanse White House of Obama demons.',1
1320,Furman University changed the name of its mascot to avoid an embarrassing acronym.,1
1321,Members of Obama Administration are Related to People in the Mainstream Media,0
1322,"'In 2010, everybody said you can't dare let guns go into the national parks, and of course the rapes, murders, robberies and assaults are down about 85 percent since we did that.'",1
1323,Overdue pregnant women induce labor by eating at specific restaurants.,1
1324,"At the 2018 World Economic Forum in Davos, Switzerland, President Trump told billionaire George Soros to 'go to hell.'",1
1325,"Leonardo DiCaprio is moving to Woodstock, Illinois.",1
1326,The Georgia Guidestones were stolen from their site and then re-erected in New Hampshire.,1
1327,Says 'Sasha Obama’s racist anti-white rant just got her expelled.',1
1328,Says Bruce Braley 'threatened to sue a neighbor over chickens that came onto (his) property.',1
1329,Macy’s is giving out $200 gift cards to users who follow three simple steps on Facebook.,1
1330,Rebuilding three high schools will benefit 40 percent of Portland Public School students.,1
1331,"After the shootings of Dallas policemen, 'nearly 500 people applied in just 12 days.'",0
1332,The damage to the Pentagon on September 11 was caused by something other than a hijacked Boeing 757's being crashed into its side.,1
1333,"In one of his films, actor Tony Curtis delivered the line, “Yondah lies da castle of my foddah.”",1
1334,'The Obama administration was begging for a meeting' with Kim Jong Un.,1
1335,"A photograph shows a real, inhabitable house built on the underside of a cliff.",1
1336,Senator Ted Cruz is scheduled to speak at the 2016 Democratic National Convention.,1
1337,Michelle Obama urged Kansas schoolchildren to 'monitor their grandparents for racial intolerance.',1
1338,'Ashley Moody was a lifelong Democrat.' ​,1
1339,"'Obama, Biden and their liberal allies oppose clean coal.'",1
1340,"'Following the 2009 session,' Texas House Speaker Joe Straus 'was acknowledged and ‘thanked’ for his ‘tireless efforts’ by Planned Parenthood, the nation’s premier abortion provider.'",0
1341,'Congressman McCollum voted to dismantle Social Security.',1
1342,"Under the new health care law, 'if a landscaper wants to buy a new lawnmower, or a restaurant needs a new ice-maker, they have to report that to the feds.'",0
1343,"'For every $10,000 invested in business incubators, up to nearly 70 local jobs are generated.'",0
1344,Hillary Clinton wants to bring an end to the United States as we know it in favor of a 'hemispheric government.',1
1345,"'A family of four can make up to $88,000 a year and still get a subsidy for health insurance' under the new federal health care law.",0
1346,Hillary Clinton used a green screen to add fake audience members during her August 2016 speech in Nevada.,1
1347,South Africa has 3.7 million orphans,1
1348,'Ninety-seven percent of the time. That’s how often Mark Warner votes with President Obama.',0
1349,Says Beto O’Rourke said he’s grateful that people are burning or desecrating the American flag.,1
1350,Thieves at shopping malls are placing sharpened spikes up against the tires of shoppers’ vehicles with an eye to disabling these vehicles and robbing shoppers who are attempting to drive home.,1
1351,"Under current conditions, by 2023, the interest payments on the national debt will be $722 billion, larger than the projected defense spending of $696 billion.",0
1352,Video clip shows police ignoring a getaway car full of bank robbers.,1
1353,Brewery employees discover the body of a worker in a vat of beer.,1
1354,On multiple occasions Donald Trump tweeted predictions that President Obama would order an attack on Iran.,0
1355,More people are apprehended after illegally crossing the U.S.-Mexico border a week 'than are born in Texas each week.',0
1356,Human trafficking rings are using job interviews to lure college students.,1
1357,A photograph of a shark leaping out of the water is real and won an award from National Geographic.,1
1358,"Says Scott Walker said 'Labor unions don’t deserve to have a national holiday' due to their damage to the economy. And the holiday 'should be replaced by Patriots Day, celebrated every year on 9/11.'",1
1359,"'We closed that plant down. It was a $27 million-dollar plant, operating full steam, and we closed it down.'",0
1360,U.S. postage stamps may not be resold for a price greater than their face value.,1
1361,"'Star Trek' star Patrick Stewart admitted he originally refused to see the 'Galaxy Quest' movie, but eventually he did so and greatly enjoyed the film.",0
1362,Congress supported a bailout of AIG because that company insures the Congressional pension trust.,1
1363,"'Over the past year ... our 16 counties have hemorrhaged more than 6,000 jobs with no apparent end in sight.'",1
1364,Obama has 'visited more countries and met with more world leaders than any president in his first six months in office.',0
1365,The 22nd day of the 2nd month of the year 2022 will fall on a Tuesday.,0
1366,"'Most federal employees do not have collective bargaining for benefits, nor for pay.'",0
1367,A video shows a group of penguins living on an island of plastic.,1
1368,'Bay Area liberals have given more to Jon Ossoff's campaign than people in Georgia.',1
1369,"U.S. Reps. Hank Johnson, John Lewis and other members of the Congressional Progressive Caucus are 'socialists who are openly serving in the U.S. Congress.'",1
1370,Says '74 percent of small-business people believe that Obamacare is a bad idea.',1
1371,"Former FBI agent Peter Strzok issued a tweet calling President Trump a 'dictator,' a 'Russian asset,' and an 'unhinged madman.'",1
1372,Photographs show the missing Malaysia Airlines Flight MH370 floating in the ocean.,1
1373,Netflix announced in April 2017 that it was creating a new 'Harry Potter' television series.,1
1374,Says Delta offers a discount to Planned Parenthood.,1
1375,"'Yes, this would be the same congressman (Rep. Pete Hoekstra) who last year Tweeted the whereabouts of a top-secret mission to Iraq.'",1
1376,Comedian Trevor Noah said black South Africans should direct their anger at whites instead of immigrants.,1
1377,American Muslims for Jerusalem have called for a boycott of Estee Lauder products.,0
1378,"The show 'The Simpsons' predicted the common autocorrect feature on phones, tablets and computers.",1
1379,Rob Zombie was kicked out of the 88th Academy Awards.,1
1380,'We've already lost $500 million in economic impact' from HB2 fallout in North Carolina.,1
1381,Studies have demonstrated that Monsanto-developed corn contains toxins that cause organ failure in rats and adverse effects in pregnant women.,1
1382,McGinty previously told a local community newspaper in her native Philadelphia that she 'has found an alarming undercurrent of misinformed people in the 'T' part of the state' outside of Philadelphia and Pittsburgh.,1
1383,"Facebook has not one, but two filtered message inboxes where Messenger messages may not be easily seen.",0
1384,Pregnant woman tries to beat carpool lane ticket by asserting her fetus counts as a second person.,0
1385,Seven claims about the government's achievements,1
1386,'Nobody dies because they don’t have access to health care.',1
1387,"'Congressman Cicilline, when he was the mayor of Providence, espoused a sanctuary city.'",1
1388,'Martin Luther King Jr. was a Republican!',1
1389,Kenya’s parliament approves county funding based on five-year-old revenue data,0
1390,Slideshow presents photorealistic paintings by an artist named Anna Kostenko.,1
1391,Two of Hillary Clinton employees were arrested for destroying evidence related to a uranium probe.,1
1392,"Massapequa, New York pizza restaurant Villaggio's refused to serve a soldier named John Welch because he visited with a service dog.",1
1393,President Bush misspoke at a right-to-life rally and repeatedly said ‘feces’ instead of ‘fetus.’,1
1394,A photograph shows a 'rainbow owl' that dwells in the U.S. and China.,1
1395,Republican VP candidate Mike Pence doesn't want to be referred to as the vice president because he opposes use of the word 'vice' on religious grounds.,1
1396,An image shows a disheveled President Trump texting at Mar-A-Lago.,1
1397,"Says Abraham Lincoln tried to buy slaves' freedom in border states, but the states 'all rejected it.'",0
1398,The United States has experienced '40 straight months of unemployment at 8 percent or higher.',0
1399,Obamacare 'prevents (Florida) from regulating insurance.',1
1400,President Obama issued a full pardon for rapper C-Murder.,1
1401,Says Republican gubernatorial candidate Adam Laxalt 'tried to cut a deal with big pharma' in a lawsuit.,1
1402,A photograph shows a skull-like cloud formation above California.,1
1403,'More than half of death row prisoners are people of color.',0
1404,A golfer angered by a bad shot was killed by the club he threw in frustration.,0
1405,An image shows President Trump partying with a stripper.,1
1406,A photograph shows President Obama posing next to a 69 or 420 mile marker.,1
1407,Some granite countertops may emit radon.,0
1408,'Every (personhood) bill I’ve ever support has either had language that says we’re conforming to the constitutional rulings of the Supreme Court or something to that effect.',1
1409,Iraqi militant web site displays image of action figure toy identified as a captured American soldier.,0
1410,"In 2017, 2018 or 2019, the U.S. Centers for Disease Control and Prevention warned the public about a shipment of Zika-contaminated bananas.",1
1411,Statistics demonstrate that crime rates in Australia have increased substantially since the government there instituted a gun buy-back program in 1997.,1
1412,"'Within a few years, we will be spending more on interest payments than on national security.'",1
1413,false,1
1414,We have the fourth highest in-state tuition for public universities in the country.,0
1415,The striped mittenfish can change its sex by turning its entire body inside out.,1
1416,A GoFundMe campaign raised millions of dollars for the construction of a border wall within a few days of its launch in December 2018.,0
1417,The 2005 movie Category 7: The End of the World predicted the arrival of hurricanes named Harvey and Irma.,1
1418,Musician Jay-Z said that 'satan is our true lord' and that 'only idiots believe in Jesus' during a backstage tirade in November 2017.,1
1419,"'Over 3 million Americans are employed in the growing green-collar workforce,' which is more than the number 'of people working in the fossil fuel industry.'",0
1420,'Putin Interference Could Give Courts Legal Right to Make Hillary President.',1
1421,Celebrities Call for Hollywood Strike Until Donald Trump Resigns,1
1422,A man soared three miles above Los Angeles in an “aircraft” consisting of an aluminum lawn chair tethered to helium weather balloons.,0
1423,Photographs show the aftermath of a dog vs. porcupine encounter.,0
1424,George W. Bush accidentally voted for Barack Obama in the 2012 presidential election.,1
1425,"Says Planned Parenthood founder Margaret Sanger said, 'Slav, Latin and Hebrew immigrants are human weeds . . . a deadweight of human waste. Blacks, soldiers and Jews are a menace to race.'",1
1426,Says U.S. Rep. Steve Southerland 'voted himself health care for life.',1
1427,Video shows a truck pushing an automobile trapped in front of its grille.,0
1428,Playboy published nude photographs of 10-year-old actress Brooke Shields.,0
1429,The lyrics of James Taylor's 'Fire and Rain' chronicle his reaction to the death of his girlfriend in a plane crash.,1
1430,"Spirit Airlines offers innuendo-laced promotions, including $69 fares.",0
1431,"'We, the bishops of the United States -- can you believe it -- in 1919 came out for more affordable, more comprehensive, more universal health care.'",0
1432,A photograph shows the Clintons posing with Palestinian leader Yasser Arafat.,0
1433,Mark Warner voted for 'nearly $1 trillion in new taxes and $7 trillion in new debt.',0
