,tweets,label
0,North Korean official Jang Sung-taek was executed by being thrown into a cage with 120 starved dogs.,1
1,In May 2017 President Trump launched a monthly 'Big League Box' subscription for campaign merchandise.,0
2,Mickey Mantle sent a crude response when Yankees publicity officials asked him to describe his 'outstanding event' at Yankee Stadium.,0
3,Gabapentin is now considered the most dangerous drug in America and will surpass opioids as the largest prescription drug killer.,1
4,Woman sells her partner's expensive new car for $50 after he runs off with a younger woman.,1
5,Usain Bolt donated $10 million and Shakira donated $15 million to help rebuild Haiti after Hurricane Matthew.,1
6,Obama's tax plan cuts taxes 'for 95 percent of all working families.',0
7,'We are at a 40-year low in our crime rate in our state.',0
8,Jill Stein was arrested and charged with embezzling money raised for 2016 recount efforts in order to throw a 'marijuana dinner party.',1
9,Says President Barack Obama made it 'legal' for the media to 'purposely lie' to the public when he 'quietly signed into law HR 4310 in 2012.',1
10,NFL quarterback Tim Tebow was arrested for soliciting a prostitute.,1
11,Kid dies doing the latest dance step in a video.,1
12,"New jobs numbers are in, and Wisconsin has 'fallen to dead last in Midwest job growth.'",1
13,Photograph shows representatives playing solitaire on their laptop computers during a legislative session.,0
14,ABC fired Joy Behar from her job co-hosting 'The View' after she made comments about Vice President Mike Pence's religious beliefs.,1
15,Benzene has 'never been proven to be harmful.',1
16,A message with a subject line of “Shakira’s Pictures” may include a virus.,0
17,'Congressman Nye voted against a bill which would have defunded the $5-10 billion' the IRS needed to implement  health care legislation.,1
18,"As of October 2017, would-be recipients of a repair grant from Dickinson, Texas, must promise not to boycott Israel.",0
19,Says 11 soccer players on the U.S. Men’s National Team are immigrants.,1
20,A little-known painting entitled 'Cat Prevents House Fire' was created by Norman Rockwell.,1
21,A video shows DragonAir 737 being spun around in strong winds from a typhoon.,1
22,"'There have been multiple media reports about (Donald Trump's) business dealings with the mob, with the mafia.'",0
23,You can direct money to hunger relief simply by clicking a button on a web site.,0
24,A Houston man was sentenced to jail for paying too much child support for his son.,1
25,U.S. Sen. Bernie Sanders said 'Christianity is an insult to Muslims.',1
26,A collector deliberately placed three valuable U.S. coins into circulation in New York in April 2006.,0
27,Trey Gowdy was forced into protective custody after two people investigating Hillary Clinton went missing.,1
28,Says Ralph Hall is 'the oldest member in Congress ever.',1
29,Trump: Harriet Tubman Belongs on Food Stamps,1
30,"'A few weeks ago, (the) education committee in Congress is deciding what’s going to be in your local salad bar.'",1
31,A resolution introduced to the House of Representatives seeks to repeal the authorization for use of military force against Iraq.,0
32,Schoolkids are smoking and injecting crushed bedbugs to get high from a hallucinogenic substance they contain.,1
33,A vintage advertisement offered a 'Big Dick' machine gun for boys.,0
34,'Hillary Clinton and her campaign of 2008 started the birther controversy.',1
35,Mental health provisions related to mass shootings 'got over 90 votes in the Senate.',0
36,Claims to show a photo of Alexandria Ocasio-Cortez with her legs spread.,1
37,"'Over the next two years, this $1.8 billion deficit will cost individual Wisconsinites $300 each, or $1,200 for families of four.'",1
38,Obamacare is 'one big fat VA system.',1
39,"The morning after a one-night fling, a man walks into his bathroom and finds the words “WELCOME TO THE WORLD OF AIDS” scrawled on the mirror in lipstick.",1
40,"'13,000 Floridians are able to vote -- but their governor won't tell them.'",1
41,The Senate Republican education plan is an unfunded mandate for local school districts.,0
42,At least 260 members of the U.S. Congress have settled sexual assault charges.,1
43,Henry Kissinger spoke to a 'eugenics council' on controlling populations through forcible vaccinations.,1
44,A student's school assignment to write an essay on her hero was rejected by her teacher because she chose 'Jesus Christ' as her subject.,1
45,'We haven’t had control of the House for the last two years and it’s been malfunctioning. We had 109 sessions scheduled and held 49.',0
46,The Mueller report was leaked.,1
47,The Washington Redskins were stranded in their locker rooms overnight by Philadelphia police angry that players 'took a knee' during a game against the Eagles on 23 October 2017.,1
48,A 1944 article describes Republican calls for U.S. forces to be withdrawn from Europe.,1
49,Providence's port is '200 miles closer to Europe than any other Eastern port.',1
50,Republican presidential candidate Donald Trump has died of a 'violent heart attack.',1
51,Whoopi Goldberg called Judge Jeanine  Pirro a 'sand n***er' after the latter's appearance on 'The View.',1
52,'There are still tens of thousands of missing service members from previous and current conflicts that our nation is working to find and repatriate.',0
53,A dangerous new drug known as 'gray death' can kill through the air and skin contact.,0
54,Hillary Clinton said in a speech that Christians in America must deny their faith in Christianity.,1
55,Donald Trump has been disqualified from running for President due to his comments about Muslims.,1
56,"Virginia spends $400,000 on abstinence programs while losing $2.5 million in federal funds due to Gov. Bob McDonnell’s 'political agenda.'",0
57,November 2018 marked the first Veterans Day in 56 years upon which the sitting U.S. president did not attend a wreath-laying ceremony at the Tomb of the Unknown Soldier in Arlington National Cemetery.,1
58,"A registrar, as a joke, fills one entire class with students whose last names are also animal names (e.g., Byrd, Fox, Lyon, Finch, Lamb).",1
59,Sen. Lindsey Graham called President Donald Trump a 'race-baiting xenophobic bigot' in 2015 but in 2018 claimed that he had 'never heard him make a single racist statement.',0
60,"Secret flights whisked bin Laden family members and Saudi nationals out of the U.S. immediately after September 11 while a general ban on air travel was still in effect, and before the FBI had any opportunity to question any of the passengers.",1
61,A teen boy died of 'orgasmic shock' after masturbating 46 times in a row.,1
62,Donald Trump paid Sarah Palin $10 million for her endorsement.,1
63,McDonald's released a holiday cup that unintentionally featured a risqué image.,1
64,"A Black Lives Matter protest in Memphis obstructed I-40, leading to the death of a critically ill child transplant patient.",1
65,The Bitstrips app is a trojan horse that gives the NSA secret access to personal user information.,1
66,A photograph shows a large species of megabat.,0
67,Says the White House nativity scene was removed by the Obamas and 'is back in the White House thanks to First Lady Melania Trump.',1
68,A photograph shows a shark swimming down a highway after a hurricane.,1
69,All 'Obama phones' will be cut off after 31 December 2016.,1
70,George Zimmerman said that it was God’s plan for him to shoot Trayon Martin.,1
71,An Oklahoma teacher was fired for praying when a tornado hit her school.,1
72,'FBI issues Warrant For Obama’s Arrest After Confirming Illegal Trump Tower Wiretap.',1
73,Monstrously large catfish lurk underwater at the base of dams.,1
74,California has 'the highest poverty rate in the nation' when considering the U.S. Census Bureau’s Supplemental Poverty Measure.,0
75,Chipotle has stopped offering pork at its restaurants in order to appease Muslim customers.,1
76,Says state Senate recall challenger Sandy Pasch voted 'to cut school aid by nearly $300 million.',0
77,"A species of cephalopod known as the Pacific Northwest Tree Octopus, that can live on both land and water, is endangered.",1
78,'The fact is voter fraud is rampant.',1
79,A photograph shows President Trump with balloons stuffed into his shirt.,1
80,"'Over half of the young people' in medical, dental and law schools are women.",1
81,President Obama declared that he would move his family to Canada if Donald Trump were elected president.,1
82,Razor blades were discovered glued to playground equipment in a public park.,0
83,A Denver man murdered a woman whose behavior was inspired by the #WasteHisTime hashtag on Twitter.,1
84,'(Palin) supported right-wing extremist Pat Buchanan for president in 2000.',1
85,Vanna White was fired from her hostess role on 'Wheel of Fortune' due to her compulsive roulette playing.,1
86,Barack Obama wants to 'unilaterally disarm our nation.',1
87,'Most of the jobs that we lost were lost before the economic policies we put in place had any effect.',0
88,Facebook is deleting an image of a cross carved in honor fallen firefighters.,1
89,E-mail petition started by the son of a New York firefighter seeks to establish a National Firefighters Day.,0
90,Congress has a 'slush fund' from which it has paid $17 million to women who accused members of sexual harassment or abuse.,1
91,Hoboken Mayor Ravi Bhalla promised to 'glorify Islam' after being elected.,1
92,"The merger of Georgia State University and Georgia Perimeter College will make GSU one of the largest universities in the nation, with more than 54,000 students.",0
93,'More than 20 million people are at risk of dying from starvation within 6 months in 4 nations.',0
94,Former President George H.W. Bush has died of food poisoning.,1
95,"Says unlike Tim Kaine, who 'invested' in education, Indiana Gov. Mike Pence 'slashed education funding.'",1
96,Says the 'bones of children' were found on Jeffrey Epstein’s island.,1
97,"A video shows a group of 'radical' Muslims rallying around a painting of Jesus' decapitated head in Dearborn, Michigan.",1
98,"President George W. Bush proclaimed, “The problem with the French is that they don’t have a word for entrepreneur.”",1
99,'The number of inmates since 2000 on death row dying of natural causes has now surpassed the number of inmates executed.',0
100,A family dog saved sleeping young children from sexual abuse by biting off an intruder's genitals.,1
101,Says six eradicated diseases such as whooping cough and the bubonic plague are making a comeback 'thanks to refugees and illegal immigrants.',1
102,"'Rural schools enroll 40 percent of American children, but receive only 22 percent of federal education funding.'",1
103,"'Fireworks have never been safer, and their use continues to increase each year.'",0
104,Payment of U.S. federal income taxes is voluntary.,1
105,Jeff Goldblum criticized Mark Zuckerberg and Elon Musk for being capitalists during an MTV interview.,1
106,Cobb is one of the largest school systems (in the nation) that is debt free.,0
107,Heroin and prescription opioids are 'the number one cause of accidental or preventable death in Wisconsin.',1
108,A commencement speech by the Commanding Officer of Fort Benning touched off riots that killed 11 people.,1
109,Says a photograph shows Seattle Seahawks player Michael Bennett burning the United States flag.,1
110,Actress Martha Raye entertained troops and tended to wounded soldiers in the field in Vietnam.,0
111,Labor Union Tells Supporters to Vote For U.S. Flag Ban on Fox News Poll,1
112,Country music singer Merle Haggard left his entire estate to an LGBT group.,1
113,Pope Francis cancelled the Bible and proposed the creation of a new holy book.,1
114,Photograph shows a “redneck mansion” composed of several linked trailers.,1
115,Says Barack Obama 'didn’t do executive orders in the beginning.',1
116,"A picture shows Vice President Joe Biden groping Stephanie Carter, wife of former defense secretary Ash Carter, during a government ceremony.",1
117,"Says, 'Oregon has the third largest class size in the nation.'",0
118,"Financial conflict-of-interest 'laws don't apply to the president, right? So, the president doesn't have to have a blind trust.'",0
119,Barack Obama has been endorsed for President of the U.S. by the Ku Klux Klan.,1
120,Disaster survivor gives mistaken answer to an interviewer’s question about the loss of churches in her area.,1
121,'We are experiencing the worst economic recovery America has ever had.',1
122,Cleveland Indians second baseman Joe Gordon deliberately struck out to prevent rookie Larry Doby from looking bad during his first at-bat.,1
123,President Obama’s health care law 'represents a government takeover of health care.',1
124,"On 1 May 2016, Saturn will be prominently visible in both the day and night sky.",1
125,Saudi scientists announced that theyhad determined women were mammals but not humans.,1
126,Tampa mayoral opponent Bob Buckhorn 'supported forcing police officers to keep their guns locked in the trunks of their cruisers.',1
127,'Martin Luther King was a Republican.',1
128,Julian Assange was kidnapped from the Ecuadorean embassy in London and murdered in April 2017.,1
129,Chewing gum takes seven years to pass through the human digestive system.,1
130,The Baby Ink body art chain specializes in tattooing babies and children.,1
131,Russian President Vladimir Putin endorsed Sen. Bernie Sanders for President.,1
132,Singer DMX was arrested in 2014 for running a dogfighting ring.,1
133,The presence of electronic devices (such as iPods and cell phones) on one’s body can make lightning strike injuries more severe.,0
134,Abraham Lincoln issued a prophetic warning about the tyranny of capitalism.,1
135,'There’s no money' for Planned Parenthood in the bill that would keep the government open.,0
136,"Shortly before he died, a teen named Brian Moore penned the Internet essay now known as “The Room.”",1
137,Donald Trump referred to Canadians as 'snow Mexicans' in a 22 February 2016 tweet.,1
138,Senator Lindsey Graham once said that Republicans would 'get destroyed' if they nominated Donald Trump as their presidential candidate.,0
139,A Japanese man was found dead months after being crushed by huge pile of pornography.,1
140,'I have never asked for nor received a single earmark or pork barrel project for my state.',1
141,A Zimbabwean inventor named Sangulani Maxwell Chikumbutso invented an electric car that requires no charging.,1
142,"While fighting a move to toughen penalties for workplace gender discrimination, state Sen. Glenn Grothman said 'he didn’t believe women belonged in the workplace' but belonged 'at home, cooking and cleaning and having babies.'",1
143,"'Up until two weeks ago, John McCain was a leading proponent of amnesty. Now with me challenging him, suddenly he has changed.'",1
144,President Obama plans to implement a pay freeze for active duty military personnel in 2011.,1
145,'Charlottesville car attacker is anti-Trump Antifa supporter.',1
146,Mattel has released a burka Barbie doll for the toy’s 50th anniversary.,1
147,"A student in a marine biology class turns in a term paper which includes a lavishly-drawn illustration of a whale and receives an A.  The next year a different student copies the paper, submits it, and also receives an A.  The third student to hand in the same paper, however, neglects to include the drawing of the whale and receives only a B from the professor and his written comment: “I liked it better with the whale.”",1
148,E-mail reproduces Rev. Jesse Lee Peterson’s editorial critical of New Orleans blacks and their “moral poverty.”,0
149,Singer Miley Cyrus drowned in a bathtub due to a prescription drug overdose.,1
150,'This is not a mosque. It's a cultural center that has a prayer area.',1
151,Says Ohio's Issue 2 will create a redistricting commission that will 'have a blank check to spend our money.',1
152,Was Martha Kanter 'dispatched to Corvallis with $17 million in stimulus money' to save Craig Robinson’s job?,1
153,Sasha Obama was killed in a drive-by shooting in July 2017.,1
154,The Ramnit worm has been stealing Facebook credentials.,0
155,Bush lied about weapons in Iraq?  What about the Democrats,0
156,Black Lives Matter leader Marquesha Johnson was sued for embezzling millions of dollars in donations.,1
157,The unemployment rate may be as high as '42 percent.',1
158,"Nine claims ranging from diaspora remittances to the constitution, railways, electricity and Kenya’s development.",0
159,“South Africa has one of the highest rates of rape in the world.”,0
160,"On hot summer days, you should avoid filling your car’s gas tank completely due to a risk of explosion.",1
161,"A fisherman captured a 3,000 lb. great white shark in the Great Lakes.",1
162,Fifteen homeless people in Chicago were found dead on the street because of record-low temperatures that hit the city in late January 2019.,1
163,A Kentucky Fried Chicken outlet in New York advertised a ‘Hillary Special.’,1
164,A Florida gun owner voluntarily gave up his AR-57 rifle to law enforcement after the Parkland school shooting.,0
165,Says President Barack Obama 'built this $16 trillion debt.',1
166,The word gringo came from Mexicans’ overhearing American soldiers sing the song “Green Grow the Lilacs” during the Mexican-American War.,1
167,Fox News has hired Whoopi Goldberg.,1
168,The Muslim Brotherhood has 'openly stated they want to declare war on Israel.',1
169,U.S. Congresswoman Alexandria Ocasio-Cortez said that 'private truck drivers are destroying America.',1
170,McCain says the price of a gas tax 'holiday' would be about the same as 'a Bridge to Nowhere (or) another pork barrel project.',1
171,Presidential daughter Malia Obama was named the highest-paid heir in 2017.,1
172,Pope Francis once said “Women are naturally unfit for political office.”,1
173,A video shows a sea cucumber that resembles a headless chicken.,0
174,'We now have about one-third of New York’s population on Medicaid.',0
175,Says he 'fought Obama twice and won to stop illegal immigrants from voting.',1
176,A somber image shows a man whose wife and two children were killed in a car accident.,1
177,First Lady Michelle Obama proposed a “Hug A Muslim” day to replace Columbus Day.,1
178,"Jon Voight once said 'I pray all Americans who have seen and felt the meltdown of America with the Obama years, to please fight for Donald Trump'",0
179,Mike Pence said Michelle Obama 'is the most vulgar First Lady we've ever had',1
180,Says Bill Nelson 'voted to raise our taxes 150 times.',1
181,Stormy Daniels said in an interview that Donald Trump ordered little pizzas as toppings on a regular-sized pizza.,1
182,"Under my platform, 'I will make no changes to the current (Medicare) system for current retirees and anyone approaching retirement.'",1
183,Says President Barack Obama 'has not condemned' shootings targeting police.,1
184,'Household income among Hispanic Americans has just set a new record high.',0
185,Members of Congress and their families and staff are exempt from repaying student loans.,1
186,"'In Congress, Elizabeth Warren introduced 110 bills. 2 passed. Cory Booker introduced 120 bills. 0 passed. Kamala Harris introduced 54 bills. 0 passed. Bernie Sanders never held a job until age 53. He lived off of welfare and four different women.'",1
187,President Reagan warned the public against demagogues who advocated a trade war against America's friendly trading partners in the name of protectionism.,0
188,You can avoid paying for traffic tickets or establish a new identity by obtaining an International Driver’s License.,1
189,The U.S. Department of Interior sent out an official news release stating that President Obama was reducing the size of the Navajo Reservation.,1
190,The Human Rights Campaign is 'more powerful than the NRA.',1
191,Bill Ripken's 1989 Fleer baseball card includes a hidden obscenity.,0
192,Silent film star Buster Keaton was contractually precluded from smiling on-screen.,1
193,Donald Trump is revealing information documenting that Barack and Michelle Obama were once on the verge of divorce.,1
194,Says a progressive income tax proposal from Democratic governor candidate J.B. Pritzker 'is wholly regressive.',1
195,Says Nevada lawmakers voted to allow teenaged boys to 'shower with your teenaged girls in public school locker rooms.',1
196,Map shows an optimal route for driving across the USA and hitting major landmarks in every state.,0
197,"Studies show 'the 2016 shooting and murder rate in Chicago cost us about $9.6 BILLION DOLLARS' and 'the entire City budget for 2018 is $8.6 billion dollars. This math does not work, it is financially killing our city.'",1
198,A study found that 80 percent of black men in Georgia were homosexual.,1
199,"'If you're a Mexican, you get sent back. ... But if you're from a noncontiguous country like the Central American countries' then you can stay in the United States.",0
200,'Jesus was an undocumented immigrant.',1
201,"'No Republicans voted for' recent hikes in the income tax, payroll tax, capital gains tax, dividend tax and estate tax. 'These taxes were all passed under … Obamacare.'",1
202,An Iowa policy 'provides for a state round up of Iowa citizens who might be exposed to the swine flu virus.',1
203,"Says the stimulus bill sent tax credits overseas, such as 'half a billion to an electric car company that created hundreds of jobs in Finland.'",1
204,Democratic senators “sent a letter to the prosecutor in Ukraine” in 2018 asking him to 'investigate Trump.”,1
205,"A forthcoming Russian reality show called 'Game2: Winter' will permit contestants to commit crimes, including rape and murder.",1
206,'Our children do not spend any time in school learning about our own U.S. Constitution.',1
207,Dr. Charles Stanley wrote an exhortation to Christians to pray for a John McCain victory in the presidential election.,1
208,CNN accidentally aired 30 minutes of pornography in Boston on Thanksgiving night.,1
209,Democrats 'setup' and 'manipulated' the political violence in Charlottesville,1
210,Researchers have developed genetically engineered fruit trees that bear meat.,1
211,"Delta Air Lines Delta is giving away free boxes with first-class air travel tickets and $10,000 in cash to those who follow online links.",1
212,"'This issue of busing voters in to New Hampshire is widely known by anyone who’s worked in New Hampshire politics. It’s very real, it’s very serious.'",1
213,President Obama implemented a new government policy prohibiting U.S. service members from speaking at “faith-based public events.”,1
214,States with 'the highest gun ownership rates also have the highest suicide rates.',0
215,A photograph shared widely on social media in July 2019 shows former U.S. Secretary of Labor Alex Acosta and his family.,0
216,"Lack of Food Taster Prevented President From Eating With
Republicans",0
217,'There haven't been tax cuts for the rich' in Rhode Island.,1
218,"Says the word newspaper stands for 'north, east, west, south, past and present event report.'",1
219,Escape artist Harry Houdini died from a ruptured appendix caused by his being punched in the stomach.,1
220,Mark Zuckerberg said that he was 'disgusted with social media' and that he was leaving Facebook as a result.,1
221,President Trump's notorious 'fist pump' at a Pennsylvania airport on 9/11 was offered as a greeting to a cancer victim.,1
222,A dragon skeleton was discovered in northern Iceland.,1
223,A drunk’s attempt to escape the long arm of the law goes awry when he drives off from the scene of the arrest in the wrong car.,1
224,"Photographs show Molly, a horse with a prosthetic leg.",0
225,The song 'The Twelve Days of Christmas' was created as a coded reference to important articles of the Christian faith.,1
226,Scammers trick e-mail users into opening virus-launching attachments by sending phony package delivery failure notifications.,0
227,Says China and Singapore impose the death penalty on drug dealers.,0
228,"President Barack Obama 'is the first president to keep a dog-trainer on retainer for $102,000 a year at taxpayer expense.'",1
229,"A sign in Calvert County, Maryland was erected in May 2018, warning 'liberals' to arm themselves in the event of attempts to impeach President Donald Trump.",0
230,Disney announced in March 2018 that it was remaking 'Bedknobs and Broomsticks' with Kate Winslet.,1
231,"In 2005, Senator Barack Obama expressed his opposition to 'undetected, undocumented, unchecked' immigration.",0
232,"'Actor Brad Pitt: ‘Trump is not my president, we have no future with this…’'",1
233,"Says Milwaukee County spent over $170,000 in salaries in 2010 for employees to 'participate in union activities such as collective bargaining.'",0
234,Kid Rock was photographed wearing a t-shirt featuring an electoral map in which blue states are labeled 'Dumbfuckistan.',1
235,Hate crime charges against four black people accused of beating a white teen were dropped.,1
236,The national debt grew an estimated $15 billion last weekend.,0
237,Former first daughter Malia Obama founded a website intended to discredit President Donald Trump.,1
238,Photographs show a black bear with a white cub.,0
239,Orson Scott Card's Open Letter To Every Local Paper in USA,0
240,Colin Kaepernick is lobbying to remove the National Anthem from football games.,1
241,Scam traps the unwary into giving up their AOL information by telling them roses have been ordered through 1-800-Flowers.,0
242,'Former President Bill Clinton and his Clinton Health Access Initiative (CHAI) distributed ‘watered-down’ HIV/AIDS drugs to patients in sub-Saharan Africa.',1
243,A photograph shows a crowd with their hands raised pledging allegiance to President Obama.,1
