,tweets,label
3563,The lubricating spray WD-40 is so named because it was the product of the 40th attempt at creating a water displacing substance.',0
3564,'The insurance industry is actually run by mostly Democrats.',1
3565,Hillary Clinton in 2005 co-sponsored legislation that would jail flag burners.,0
3566,The body of a homeless man found behind a Jamaica fast food restaurant was identified as that of Bob Marley.,1
3567,"Ted Cruz: ‘I’m Christian First, American Second’",0
3568,'Mary Landrieu voted to take away your gun rights.',1
3569,A sea monster of giant size was spotted near Antarctica.,1
3570,An “expressionless” apparition in a blood-covered gown appeared at Cedars-Sinai hospital in 1972.,1
3571,"The wife of the Ferguson, Mo., police chief said African-Americans in Ferguson 'are feral and violent.'",1
3572,Romney said ''No' to in-state tuition' for illegal immigrants.,0
3573,Parents of children born between 1980 and 1991 are entitled to a $1400 settlement from Enfamil and Similac.,1
3574,The FDA has discovered that Skittles candies are being laced with cocaine.,1
3575,"Obama Authorized Funds for the Immigration of Hamas Refugees From Gaza to
the US",1
3576,The U.S. Supreme Court has ruled that motorists need not have licenses to drive vehicles on public roads.,1
3577,"A video depicts London Mayor Sadiq Khan defending September 11th terrorists, either verbally and ideologically or as their lawyer.",1
3578,Walt Disney announced that they were permanently closing the Fort Wilderness Campgrounds due to damage from Hurricane Irma.,1
3579,'West Virginia spends more tax dollars on public education than all but 13 other states and the District of Columbia.',1
3580,"The ammunition used in the Orlando shooting 'is banned by Geneva Convention. It enters the body, spins & explodes.'",1
3581,'CNN uses the same girl in 3 different Refugee Crisis pictures being saved by 3 different men.',1
3582,Ted Cruz said in a CPAC speech that diseases such as AIDS and cancer can be eradicated through prayer.,1
3583,"Says Rep. Tammy 'Duckworth has been a staunch supporter of expanding the spending, size and reach of the IRS.'",1
3584,"The week after Hurricane Katrina hit the Gulf Coast, the game show The Price Is Right aired an episode offering contestants a trip to New Orleans as a prize.",0
3585,Woman wins lottery twice after dreaming about the winning combination.,0
3586,"Says Jennifer Aniston said, 'Me and all the Trump supporter celebrities decide to make a company named ‘celebrities for Trump’'",1
3587,'More than half of women under 30 who give birth do so outside of marriage...',0
3588,Images of the World Trade Center fire reveal the face of Satan.,1
3589,Left-handed people are now eligible for disability benefits under the 'Justice for Dexterously Challenged Act.',1
3590,"(Dennis) Richardson wants to make drastic cuts to services we depend on: schools, home care for seniors, even public safety -- all so Richardson can keep more than $440 million in unspent funds for his political priorities.'",1
3591,"Says Wisconsin 'hadn’t been won by a Republican since Dwight D. Eisenhower, in 1952. And I won Wisconsin. …  Ronald Reagan, remember, Wisconsin was the state that Ronald Reagan did not win.'",1
3592,"'Currently, we're at 36 percent of our children born out of wedlock.'",0
3593,"A Harvard Study showed that Tibetan Monks can significantly raise the temperature of their fingers, toes and other extremities through meditation alone.",0
3594,The acids in Coca-Cola make it harmful to drink.,1
3595,Catholic shipyard workers believed the Titanic was doomed because her hull number read ‘NO POPE’ backwards.,1
3596,CNN’s ratings are 'way down.',1
3597,Greece 'has a GDP the size of the Dallas-Fort Worth Metroplex.',0
3598,'I never had a filibuster-proof Senate.',0
3599,The Ruby Tuesday restaurant chain accidentally demolished a competitor’s restaurant.,1
3600,House Republicans required the use of Styrofoam cups in House cafeterias that are 'part of Koch Industries.',1
3601,"'In Oregon, students are skipping math class to learn about the Bible.'",0
3602,An image comparison shows a fictional weather map from 2050 and a real weather map from June 2019.,0
3603,Ronald Reagan went golfing after the 1983 terrorist bombing of a U.S. Marines barrack in Beirut.,1
3604,Bill Cosby has received a pardon from President Obama for all 'current and future' sexual assault charges.,1
3605,Says U.S. Sen. Sherrod Brown is responsible for 'over $14 trillion in debt.',1
3606,Billionaire David Rockefeller received his sixth heart transplant at the advanced age of 99.,1
3607,'Prince William May Not Attend Royal Wedding Leaving Harry Without a Best Man; Princess Diana Would Not Be Happy',1
3608,An automobile belonging to a Marine and bearing military vanity plates was defaced in Chicago.,0
3609,The Americans for Tax Reform pledge 'relates to new taxes that were going to be initiated by legislative action.',1
3610,A new bill 'was written into the new health care reform initiative ensuring that Congress will be 100 percent exempt.',1
3611,'I get the most money from active duty officers and military personnel.',0
3612,"'The number of individuals who actually got coverage through the exchange who didn't have coverage before, or who weren't eligible for Medicaid before is relatively small. So we've turned things upside down completely for 3 million, or 4 million, or 5 million individuals.'",1
3613,There are 'no-go zones' in Sweden where the police can't enter.,1
3614,Intern at prestigious law firm sends embarrassing message to multiple co-workers,0
3615,'Our federal government has lent $2 billion to the state-owned oil company of Brazil to allow them to explore for oil and gas.',1
3616,Google CFO 'Martin Brailey' admitted that the online giant was rigging search results against President Trump.,1
3617,Says Hillary Clinton 'wants to bring in thousands of refugees to America from all around the world without any kind of security screening.',1
3618,"Charles Ramsey said that the captive women he helped rescue, and not he, should receive a reward.",0
3619,'83% of doctors have considered leaving the profession because of #Obamacare.',1
3620,Image shows an AT&T telephone bill with a “Lawful Interception Recovery Fee” to cover government wiretaps.,1
3621,Donald Trump's campaign invented a fictional speechwriter named Meredith McIver to take the heat after Melania Trump was criticized for purportedly plagiarizing Michelle Obama's 2008 convention speech.,1
3622,Says he 'didn’t have an involvement with' nutritional supplement company Mannatech.,1
3623,Page 92 of the House health care bill 'says specifically that people can't purchase private health insurance after a date certain.',1
3624,Odds of winning the Monopoly Millionaire instant win game are 1 in 3.27.,0
3625,'18 million illegal immigrants got their government checks this month' while federal workers remain unpaid.,1
3626,Ralph Goodale: 'The OECD has said that Canada is the third worst country in the world for crappy jobs.' - FactsCanada,1
3627,A food writer lapsed into a butter-induced coma after consuming 413 Red Lobster biscuits.,1
3628,"'Legally, it doesn't make any difference' which state district you live in when running for Congress.",0
3629,President Donald Trump offered to donate $1 million to a charity of Sen. Elizabeth Warren's choice if she would take a DNA test to demonstrate that she had Native American ancestry.,0
3630,Donald Trump Jr. tweeted that the family's greenskeeper missed his own sister's wedding in order to work for the Trumps.,0
3631,Congress Has Passed The American With No Abilities Act,1
3632,An Italian doctor uncovered a surprisingly simple cure for multiple sclerosis in April 2016.,1
3633,"Chrystia Freeland: In early 2015, Canada’s 'economy is not performing well compared to the rest of the world.' - FactsCanada",0
3634,First Lady Melania Trump recent 'hit' her husband with a 'shocking announcement.',1
3635,"Oregon Rep. Tina Kotek, D-Portland, has 'never held a job nor run a business'",1
3636,Dawn brand dishwashing liquid is significantly more caustic than other brands and erodes the corneas of children’s eyes.,1
3637,"Last year, Beaverton School District had the highest number of homeless students ever recorded in Oregon.",1
3638,'We spend less than 2 percent more every year. That is the lowest increase in spending since they have been keeping numbers.',0
3639,Nigeria also ranks fourth among the 30 highest TB burden countries in the world and first in Africa,1
3640,Image depicts a Swedish girl brutally abducted and raped by three refugees.,1
3641,"Facebook users can receive a $5,000 cash reward from Bill Gates for clicking a share link.",1
3642,"'When the price for oil goes up on the markets, it goes right up, but it never goes down.'",1
3643,A photograph shows a wet dog surrounded by a group of otters.,1
3644,"'Scientists have shown us (that) the greater possibilities, the real science movement, has been with adult stem cell research. It has not been with embryonic.'",1
3645,"Thousands of Marines applied for White House detail after Trump became president, and none applied during President Obama's 8 years in office.",1
3646,David Hogg gave a Nazi salute at the end of his 'March for Our Lives' speech.,1
3647,A video captures a woman named Acesha Bright committing murder.,1
3648,Jared Kushner registered to vote as a woman in New York.,1
3649,More women were killed by their husbands or boyfriends since Sept. 11 than 'all the Americans who were killed by 9/11 or in Afghanistan and Iraq.',0
3650,Says judges 'get better benefits at a lower cost than everybody else in the state.',0
3651,A vintage advertisement features a young boy eating a stick of butter.,1
3652,'Georgia has the most restrictive ballot access laws in the country.”,0
3653,Scott Maddox has run 'losing campaigns for 3 of Florida's 4 available cabinet positions.',1
3654,Harvard is offering tuition-free education to African-American students majoring in the sciences.,1
3655,'One man sacrificed for his country. One man opposed a flawed strategy in Iraq. One man had the courage to call for change. One man didn't play politics with the truth. One man stands up to the special interests.',0
3656,"Medicare monthly premiums will go up to $104.20 in 2012 and $247.00 in 2014 due to 'provisions incorporated in the Obamacare legislation, purposely delayed so as not to 'confuse' the 2012 re-election campaigns.'",1
3657,"In January 2013, future U.S. Rep. Ilhan Omar was arrested on suspicion of trespass in Minneapolis.",0
3658,'The servers of the Pakistani gentleman that worked on the DNC' are 'missing.',1
3659,Says 'Christine Blasey Ford’s letter to Sen. Dianne Feinstein revealed to be a total FAKE… contains 14 glaring errors that could only be committed by a poorly educated writer.' ​,1
3660,"Mitt Romney’s campaign slogan, “Keep America American,” is identical to a catchphrase once used by the Ku Klux Klan.",1
3661,Says a pro-choice activist in California 'proudly breaks world record by getting her 27th abortion',1
3662,The United States Postal Service is discontinuing the “Black Heritage” series of stamps and destroying the remaining stock.,1
3663,Says stories about his birth certificate drowned out media coverage of the Republican and White House budget plans the week of April 11.,1
3664,Musician Taylor Swift humiliated a fan for wearing a Trump shirt to one of her shows.,1
3665,The Green New Deal 'would do away with commercial air travel.',1
3666,Congress is beginning impeachment hearings against President Obama.,1
3667,Says Pennsylvania Republican nominee for Congress Fred Keller 'was a 50-50 shot' before his landslide victory.,1
3668,Tyson Foods has dropped Labor Day as a holiday in favor of the Muslim celebration of Eid al-Fitr.,1
3669,"The town of Ashley, Kansas, and its entire population disappeared after an earthquake in 1952.",1
3670,Former Attorney General Janet Reno said 'Donald Trump will never be president in my lifetime.',1
3671,Says Illinois Democrat David Gill 'would end Medicare.',1
3672,"In Ohio, due to Medicaid expansion, 'nearly 60,000 disabled citizens are stuck on waiting lists ... leaving them without the care they need for months or even years.'",1
3673,A man seeking sexual pleasure catches his penis in a swimming pool suction fitting.,0
3674,Facebook CEO Mark Zuckerberg has converted to Islam.,1
3675,"In Japan, 'they take a bowling ball from 20 feet up in the air and they drop it on the hood of the car. And if the hood dents, then the car doesn't qualify...It's horrible, the way we're treated.'",1
3676,John Glenn versus Howard Metzenbaum,0
3677,"'British Intelligence Seizes Clinton Foundation Warehouse, $400 Million In Cash.'",1
3678,The deal to raise the nation’s debt ceiling will 'directly link a debt ceiling increase to spending cuts for the first time ever.',1
3679,"Says Marco Rubio believes the earth is 9,000 years old and that humans hunted dinosaurs to extinction; says  Rand Paul believes the earth is 10,000 years old and God removed dinosaurs 'to make space for humans.'",1
3680,A series of photographs shows a restaurant’s 6-pound hamburger offering.,0
3681,"In 2008, then-Sen. Barack Obama 'missed 60 or 70 percent of his votes.' In 2004, John Kerry missed 'close to 60 to 70 percent' and Bob Graham missed 'over 30 percent of his votes.'",0
3682,Children’s television show host Fred Rogers hid a violent and criminal past.,1
3683,Says 'the New York Times can write a story that they know is false' yet 'they can't basically be sued.',1
3684,"'The Doherty Campaign, unlike the Cicilline Campaign, is funded mostly by individual donors -- not the big PACs that Cicilline relies on.'",1
3685,'The (national) debt really added up $75 trillion in 2010 and is on track to hit $99 trillion this year.',1
3686,A cook attempted to poison George Washington by feeding him tomatoes.,1
3687,"In July 2017, President Trump dispatched federal investigators to the hamlet of Islamberg, New York, where they uncovered 'America's worst nightmare'.",1
3688,Says Beto O’Rourke 'has a criminal record that includes DWI and burglary arrests.',0
3689,"The swine flu vaccine used in the U.S. contains squalene, a dangerous adjuvant.",1
3690,'Not a single Democrat opposed Neil Gorsuch's confirmation in 2006.',0
3691,Actress Audrey Hepburn authored a pithy list of beauty tips.,1
3692,"Says Congressman Tom McClintock, R-Calif., 'has authored three laws since he’s been in office; two renamed post offices.'",1
3693,Says there are four super PACs on the Republican side of the Texas U.S. Senate race.,0
3694,Richard Cordray’s nomination to head the Consumer Financial Protection Bureau marks the first time in Senate history 'that a political party has blocked a nomination of someone because they didn't like the construction of the agency.',0
3695,'There is nothing that we have done on Amazon that we have not done with hundreds of other projects.',0
3696,A roofer who foolishly ties his safety rope to the bumper of his wife’s car is dragged off the roof and down the street.,1
3697,'50% of the DUIs on Interstate 35 are from illegals. Ninety percent of the 50% have absolutely no identification.',1
3698,'White House staff compiled a number of gorilla documentaries into a makeshift gorilla channel' for President Donald Trump.,1
3699,'You know how many children in the history of the United States have died in a fire (at school)? Zero.',1
3700,"Says his bill, HB 97, would prevent the use of taxpayer dollars on abortions.",1
3701,"Replacing 100,000 old toilets with water-efficient models has saved 2.4 million gallons of water every day.",0
3702,"While Mayor Rick Kriseman said he would dip into reserves this year because of Hurricane Irma, he 'went into the emergency reserves before Irma ever hit.'",0
3703,A cannery stuck with unmarketable pale salmon turned this handicap around by boldly labeling their product as “Guaranteed not to turn pink in the can!”,1
3704,Video shows Jeff Gordon pranking a car salesman with a wild test drive.,1
3705,Drinking champagne could help prevent Alzheimer’s and other forms of dementia.,1
3706,'Every one of the 67 supervisors of elections' in Florida refused to carry out the effort to remove noncitizens from the voter rolls.,1
3707,'There are over 200 documented cases where (Obama) has lied.',1
3708,Hillary Clinton Called Democratic Voters Stupid,1
3709,Thirty-four of the 47 men depicted in the famous 'Declaration of Independence' painting were slaveholders.,0
3710,"Twenty two years ago, when he was running for governor, Bill Nelson missed 56 percent of his votes in the U.S. House.",0
3711,Says Dick Cheney 'supported gay marriage sooner' than Hillary Clinton.,0
3712,"Osama bin Laden was captured long ago, but the U.S. government is keeping this news under wraps until just before the 2004 Presidential election.",1
3713,The El Paso and Dayton shootings were 'false flag' attacks coordinated by the 'deep state.',1
3714,Wikileaks released a trove of 'deep state files' in late December 2017.,1
3715,Online magic trick reads the minds of those who try it and removes from a deck of five or six cards the one chosen by those people.,1
3716,“Our real Gross Domestic Product (GDP) grew by 4.9 percent in 2017.”,0
3717,David Letterman offered a “Top Ten” list about why there are no black NASCAR drivers.,1
3718,"'In two years, Gov. McAuliffe has vetoed more bills that the previous three governors issued in each of their four-year terms.'",0
3719,"Says there were 'rumors floating around' that Chicago police union officials were 'telling their officers, ‘don’t do anything. Over Memorial Day weekend, don’t intercede. If you see some criminal activity, just lay back, do nothing.’'",1
3720,Jaleel White (Steve Urkel of television’s Family Matters) committed suicide.,1
3721,Virginia has made 'no progress on jobs' since Bob McDonnell took office.,1
3722,"An opportunistic eagle makes off with a prized poodle, to the horror of its owner (and the delight of her husband).",1
3723,A student mistook examples of unsolved statistics problems for  a homework assignment and solved them.,0
3724,A group of Trump supporters misspelled the candidate's name on their shirts.,1
3725,'Application for March for Our Lives permit was made months before Parkland shooting',1
3726,'The things I said (during the prank call by a blogger posing as GOP contributor David Koch) are the things I’ve said publicly all along' about the Wisconsin budget debate.,1
3727,"Obama 'refused to not only put his hand on his heart during the Pledge of Allegiance, but refused to say the pledge.'",1
3728,"'The United States Department of Education has introduced an Islamic indoctrination program for the public schools, called ‘Access Islam.’ '",1
3729,Says there’s 'never (been) so many apprehensions ever in our history.',1
3730,Gnome captured by drug-tripping teens and stashed in their closet overnight is discovered in the morning to be a lost child.,1
3731,Planned Parenthood and the Satanic Temple have worked together to oppose laws restricting abortion rights in Missouri.,1
3732,Malia Obama was fired from an internship at the United States Embassy in Spain (not the Spanish Embassy) after being caught smoking pot on the job.,1
3733,A 2005 gay pride vote 'had nothing to do with discrimination.',1
3734,Video captures a magician performing the “greatest card trick ever.”,1
3735,General George S. Patton Jr. discovered the French were honoring a latrine pit.,0
3736,President Donald Trump posited that Canadian women were the second biggest threat to America following ISIS.,1
3737,The 2007 film The Golden Compass is based on a series of books with anti-religious themes.,0
3738,Bernie Sanders tweeted a scathing retort to Donald Trump after the latter accused the former's supporters of inciting violence at Trump rallies.,1
3739,'Hillary (Clinton) caught on tape laughing about (Hurricane) Irma ‘wiping out all of those Florida hillbillies’.',1
3740,Says Marco Rubio 'voted against the bipartisan Violence Against Women Act.',0
3741,Woman is stalked by on-line acquaintance; use the “blind carbon copy” feature in e-mail to prevent this from happening to you!,1
3742,"'Gun violence is by far the leading cause of death for young African American men, outstripping the next nine causes of death combined.'",0
3743,Driving examiner gets run over during a road test.,1
3744,A man had his thumbs surgically altered so that he could more easily operate his iPhone.,1
3745,Twenty-two missionaries (or missionary families) are about to be executed in Afghanistan.,1
3746,'It was under Barack Obama and Hillary Clinton that changed the rules of engagement that probably cost (Capt. Humayun Khan’s) life.',1
3747,Twenty-six of the deadliest 27 mass shooters in the U.S. came from fatherless homes.,1
3748,Monty Python trouper John Cleese penned a satirical article about the formation of an “Axis of Just as Evil.”,1
3749,A video captures a cat with an extremely deep meow.,1
3750,Says Sen. Richard Blumenthal said he served in Vietnam in 'Da Nang Province. Soldiers dying left and right as we battled up the hill.' And 'then he cried when (the press) caught him.',1
3751,Video clip shows a wrecking ball smashing into a passing van.,1
3752,A photograph taken during World War II shows members of the League of German Girls during a uniform inspection.,1
3753,X-rays document a man in China whose body became riddled with tapeworms due to his consumption of sashimi.,1
3754,'We have the most educated … workforce in the entire nation.',1
3755,"Video clip shows the reunion of two men with Christian, a lion they had raised as a cub.",0
3756,"Facebook is removing photographs of military amputees from their network, deeming them 'offensive.'",1
3757,Osama bin Laden has been sighted in Utah.,1
3758,The bill presented by a famed fix-it man detailed the difference between value of work done and value of the knowledge behind it.,1
3759,White House Press Secretary Sean Spicer said President Trump had authority to add words like 'covfefe' to the language.,1
3760,"'Under this tax cut, middle-class families don't save enough for a week's worth of groceries, while millionaires save enough to go on an exotic vacation.'",0
3761,Michele Bachmann said Martin Luther King would still be alive today if black people were allowed to own guns in the 1960s.,1
3762,"During the recession, 'the consumer in his native perversity has begun to save. The savings rate is now 6.2 percent.'",0
3763,A video clip shows a NASA studio-produced 'outtake' of the first manned moon landing.,1
3764,"As Tennessee governor, Phil Bredesen 'supported higher taxes on us. Higher gas taxes. Higher sales taxes.'",1
3765,Gas stations in Los Angeles are charging in excess of $6 for regular gasoline and $9 for higher-quality options.,1
3766,The minimum legal drinking age in the U.S. is being raised to twenty-five as of 2 August 2014.,1
3767,"'Gov. Scott Walker (is) more than halfway to (his) 250,000 jobs goal.'",1
3768,"In the past 27 months, President Barack Obama has created more private-sector jobs than 'in the Reagan recovery.'",1
3769,Pastor Rick Scarborough asserted that breast cancer is caused by women's 'dirty' thoughts.,1
3770,Facebook doesn't consider military emblems 'appropriate' on their social network.,1
3771,A list reproduces Saul Alinsky's rules for 'How to Create a Social State.',1
3772,"'Nearly every state that has legalized (marijuana) has also legislated that you lose your right to own a gun if you are prescribed, or buy it recreationally.'",1
3773,Says Donald Trump 'hasn’t broken his promise' to release his tax returns.,1
3774,A New Zealand farmer was arrested for selling sheep for use as sex slaves by members of the Islamic State.,1
3775,"'Instead of fighting ISIS, (the Saudis) have focused more on a campaign to oust Iran-backed Houthi rebels in Yemen.'",0
3776,"'(U.S. Reps.) Paul Ryan, Sean Duffy and Reid Ribble are … shutting down town hall meetings, or making their constituents pay to attend them.'",1
3777,"'Once a woman enters into the sex trade, her average life expectancy is seven years.'",1
3778,A bill known as the Breast Cancer Patient Protection Act seeks to require insurance companies to cover a minimum 48-hour hospital stay for patients undergoing mastectomies.,0
3779,The National Rifle Association supported the passage of a 1967 bill in the California legislature banning the open carry of loaded firearms in public.,0
3780,"'About half of the presidents have been governors; half of them, senators.'",1
3781,Says a photo shows President Ronald Reagan meeting with Taliban leaders in the White House.,1
3782,Attorney General John Ashcroft believes calico cats are a sign of the devil.,1
3783,A photograph shows an abandoned military base that was abandoned after 'something' escaped from the facility's 'experimentation room.',1
3784,Bill Clinton Used Confederate Buttons in 1992 Presidential Campaign,1
3785,House Minority Leader Nancy Pelosi tweeted that she was disgusted with 'President' Trump after the passage of a tax reform bill.,1
3786,'Donald Trump dead from a fatal heart attack!',1
3787,"Says Alexandria Ocasio-Cortez said, 'We must block Trump from stopping the return of the heroic Alabama mother from ISIS. In many ways she is more of a hero then our veterans. Welcome home sister!'",1
3788,NASA has confirmed that marijuana contains “alien DNA” from outside of our solar system.,1
3789,'It's been 17 years that we've had unemployment higher than the national average in Oregon.',0
3790,Musician Neko Case's Vermont farmhouse was badly damaged in a fire in September 2017.,0
3791,"An Evangelical Christian mom re-wrote the Harry Potter series to remove all references to witchcraft and wizardry, replacing them with “prayer and miracles.”",1
